{
  "checkpoint_id": "chk_0123456789abcdef",
  "investigation_id": "11111111-1111-4111-8111-111111111111",
  "attempt_id": "att_0123456789abcdef",
  "attempt_number": 1,
  "sequence": 3,
  "tenant_id": "tenant-acme",
  "org_scope": {
    "org_id": "org-tier1",
    "org_path": "acme/soc/tier1"
  },
  "produced_by": {
    "type": "service",
    "id": "spiffe://cybrik.local/cyber-ai/orchestrator",
    "tenant_id": "tenant-acme"
  },
  "run_status": "running",
  "stage": "hypothesis_testing",
  "progress": {
    "completed_steps": 3,
    "total_steps": 6
  },
  "checkpointed_at": "2026-07-26T08:04:00Z",
  "artifact_refs": [
    {
      "type": "ai.evidence",
      "id": "evidence-001",
      "digest": "sha256:bbbbbbbbbbbbbbbbbbbbbbbbbbbbbbbbbbbbbbbbbbbbbbbbbbbbbbbbbbbbbbbb"
    }
  ],
  "data_marking": {
    "classification": "confidential",
    "tlp": "TLP:AMBER",
    "handling": ["no-export"]
  },
  "digest": "sha256:cccccccccccccccccccccccccccccccccccccccccccccccccccccccccccccccc"
}
